{
  "schema_version": 1,
  "id": "arcee-ai",
  "provider": "Arcee Ai",
  "currency": "USD",
  "offers": [
    {
      "model_id": "trinity-large-preview",
      "model": "Arcee AI: Trinity Large Preview",
      "endpoint_path": "/chat/completions",
      "api_model_id": "arcee-ai/prime",
      "mode": "chat",
      "prices": [
        {
          "conditions": {},
          "prices": {
            "input": {
              "amount": 0.15,
              "unit": "per_1m_tokens"
            },
            "output": {
              "amount": 0.45,
              "unit": "per_1m_tokens"
            }
          },
          "currency": "USD",
          "source": "openrouter-endpoint",
          "observed_at": "2026-05-19T14:20:07.465Z",
          "raw_pricing": {
            "prompt": "0.00000015",
            "completion": "0.00000045",
            "discount": 0
          }
        }
      ],
      "other_parameters": {
        "source_model_id": "arcee-ai/trinity-large-preview",
        "endpoint_tag": "arcee-ai/prime",
        "context_length": 131000,
        "max_output_tokens": null,
        "supported_parameters": [
          "max_tokens",
          "temperature",
          "top_k",
          "top_p",
          "tools",
          "structured_outputs",
          "response_format"
        ],
        "status": 0
      },
      "sources": [
        {
          "source": "openrouter:endpoints",
          "source_id": "arcee-ai/trinity-large-preview#Arcee AI | arcee-ai/trinity-large-preview",
          "observed_at": "2026-05-19T14:20:07.465Z"
        }
      ]
    },
    {
      "model_id": "trinity-large-thinking",
      "model": "Arcee AI: Trinity Large Thinking (free)",
      "endpoint_path": "/chat/completions",
      "api_model_id": "arcee-ai",
      "mode": "chat",
      "prices": [
        {
          "conditions": {},
          "prices": {
            "input": {
              "amount": 0.25,
              "unit": "per_1m_tokens"
            },
            "output": {
              "amount": 0.8,
              "unit": "per_1m_tokens"
            }
          },
          "currency": "USD",
          "source": "openrouter-endpoint",
          "observed_at": "2026-05-19T14:20:07.465Z",
          "raw_pricing": {
            "prompt": "0.00000025",
            "completion": "0.0000008",
            "input_cache_read": "0.00000006",
            "discount": 0
          }
        }
      ],
      "other_parameters": {
        "source_model_id": "arcee-ai/trinity-large-thinking:free",
        "endpoint_tag": "arcee-ai",
        "context_length": 262144,
        "max_output_tokens": 80000,
        "supported_parameters": [
          "reasoning",
          "include_reasoning",
          "max_tokens",
          "temperature",
          "top_k",
          "top_p",
          "tools",
          "tool_choice"
        ],
        "status": 0
      },
      "sources": [
        {
          "source": "openrouter:endpoints",
          "source_id": "arcee-ai/trinity-large-thinking:free#Arcee AI | arcee-ai/trinity-large-thinking",
          "observed_at": "2026-05-19T14:20:07.465Z"
        }
      ]
    }
  ],
  "other_parameters": {},
  "last_updated": "2026-05-19T14:20:07.465Z",
  "sources": []
}
