{
  "schema_version": 1,
  "id": "upstage",
  "provider": "Upstage",
  "icon": "https://models.dev/logos/upstage.svg",
  "domain": "developers.upstage.ai",
  "base_url": "https://api.upstage.ai/v1/solar",
  "currency": "USD",
  "offers": [
    {
      "model_id": "solar-pro-3",
      "model": "Solar Pro 3",
      "endpoint_path": "/chat/completions",
      "api_model_id": "upstage",
      "mode": "chat",
      "prices": [
        {
          "conditions": {},
          "prices": {
            "input": {
              "amount": 0.15,
              "unit": "per_1m_tokens"
            },
            "output": {
              "amount": 0.6,
              "unit": "per_1m_tokens"
            }
          },
          "currency": "USD",
          "source": "openrouter-endpoint",
          "observed_at": "2026-05-19T22:11:55.841Z",
          "raw_pricing": {
            "prompt": "0.00000015",
            "completion": "0.0000006",
            "input_cache_read": "0.000000015",
            "discount": 0
          }
        }
      ],
      "other_parameters": {
        "source_model_id": "upstage/solar-pro-3",
        "endpoint_tag": "upstage",
        "context_length": 128000,
        "max_output_tokens": null,
        "supported_parameters": [
          "reasoning",
          "include_reasoning",
          "temperature",
          "max_tokens",
          "tools",
          "tool_choice",
          "structured_outputs",
          "response_format"
        ],
        "status": 0
      },
      "sources": [
        {
          "source": "openrouter:endpoints",
          "source_id": "upstage/solar-pro-3#Upstage | upstage/solar-pro-3",
          "observed_at": "2026-05-19T22:11:55.841Z"
        }
      ]
    }
  ],
  "other_parameters": {
    "models_dev": {
      "model_count": 3,
      "doc": "https://developers.upstage.ai/docs/apis/chat",
      "npm": "@ai-sdk/openai-compatible",
      "env": [
        "UPSTAGE_API_KEY"
      ]
    }
  },
  "last_updated": "2026-05-22T19:21:26.714Z",
  "sources": [
    {
      "source": "models.dev",
      "source_id": "upstage",
      "url": "https://models.dev/api.json",
      "observed_at": "2026-05-21T22:27:33.665Z"
    }
  ]
}
