{
  "schema_version": 1,
  "id": "ollama-cloud",
  "provider": "Ollama Cloud",
  "currency": "USD",
  "icon": "/assets/provider-icons/ollama-cloud.svg",
  "base_url": "https://ollama.com/v1",
  "domain": "docs.ollama.com",
  "other_parameters": {
    "models_dev": {
      "model_count": 39,
      "doc": "https://docs.ollama.com/cloud",
      "npm": "@ai-sdk/openai-compatible",
      "env": [
        "OLLAMA_API_KEY"
      ],
      "remote_icon": "https://models.dev/logos/ollama-cloud.svg"
    }
  },
  "last_updated": "2026-05-21T22:27:33.665Z",
  "offers": [],
  "sources": [
    {
      "source": "models.dev",
      "source_id": "ollama-cloud",
      "url": "https://models.dev/api.json",
      "observed_at": "2026-05-21T22:27:33.665Z"
    }
  ]
}
