{
  "schema_version": 1,
  "id": "baseten",
  "provider": "BaseTen",
  "currency": "USD",
  "offers": [
    {
      "model_id": "gpt-oss-120b",
      "model": "gpt-oss-120b (free)",
      "endpoint_path": "/chat/completions",
      "api_model_id": "baseten/fp4",
      "mode": "chat",
      "prices": [
        {
          "conditions": {},
          "prices": {
            "input": {
              "amount": 0.1,
              "unit": "per_1m_tokens"
            },
            "output": {
              "amount": 0.5,
              "unit": "per_1m_tokens"
            }
          },
          "currency": "USD",
          "source": "openrouter-endpoint",
          "observed_at": "2026-05-19T22:11:55.841Z",
          "raw_pricing": {
            "prompt": "0.0000001",
            "completion": "0.0000005",
            "discount": 0
          }
        }
      ],
      "other_parameters": {
        "source_model_id": "openai/gpt-oss-120b:free",
        "endpoint_tag": "baseten/fp4",
        "context_length": 128072,
        "max_output_tokens": 128072,
        "supported_parameters": [
          "reasoning",
          "include_reasoning",
          "max_tokens",
          "temperature",
          "stop",
          "response_format",
          "structured_outputs",
          "tools",
          "tool_choice"
        ],
        "status": 0
      },
      "sources": [
        {
          "source": "openrouter:endpoints",
          "source_id": "openai/gpt-oss-120b:free#BaseTen | openai/gpt-oss-120b",
          "observed_at": "2026-05-19T22:11:55.841Z"
        }
      ]
    }
  ],
  "other_parameters": {},
  "last_updated": "2026-05-21T19:00:07.736Z",
  "sources": []
}
