{
  "schema_version": 1,
  "id": "modelrun",
  "provider": "ModelRun",
  "currency": "USD",
  "offers": [
    {
      "model_id": "deepseek-chat-v3-0324",
      "model": "DeepSeek: DeepSeek V3 0324",
      "endpoint_path": "/chat/completions",
      "api_model_id": "modelrun/fp4",
      "mode": "chat",
      "prices": [
        {
          "conditions": {},
          "prices": {
            "input": {
              "amount": 0.22,
              "unit": "per_1m_tokens"
            },
            "output": {
              "amount": 0.8,
              "unit": "per_1m_tokens"
            }
          },
          "currency": "USD",
          "source": "openrouter-endpoint",
          "observed_at": "2026-05-18T23:02:28.889Z",
          "raw_pricing": {
            "prompt": "0.00000022",
            "completion": "0.0000008",
            "input_cache_read": "0.00000015",
            "discount": 0
          }
        }
      ],
      "other_parameters": {
        "source_model_id": "deepseek/deepseek-chat-v3-0324",
        "endpoint_tag": "modelrun/fp4",
        "context_length": 163840,
        "max_output_tokens": 163840,
        "supported_parameters": [
          "max_tokens",
          "temperature",
          "presence_penalty",
          "repetition_penalty",
          "frequency_penalty",
          "top_p",
          "top_k",
          "min_p",
          "stop"
        ],
        "status": 0
      },
      "sources": [
        {
          "source": "openrouter:endpoints",
          "source_id": "deepseek/deepseek-chat-v3-0324#ModelRun | deepseek/deepseek-chat-v3-0324",
          "observed_at": "2026-05-18T23:02:28.889Z"
        }
      ]
    },
    {
      "model_id": "kimi-k2.5",
      "model": "MoonshotAI: Kimi K2.5",
      "endpoint_path": "/images/generations",
      "api_model_id": "modelrun/fp4",
      "mode": "image",
      "prices": [
        {
          "conditions": {},
          "prices": {
            "input": {
              "amount": 0.4,
              "unit": "per_1m_tokens"
            },
            "output": {
              "amount": 1.9,
              "unit": "per_1m_tokens"
            }
          },
          "currency": "USD",
          "source": "openrouter-endpoint",
          "observed_at": "2026-05-18T23:02:28.889Z",
          "raw_pricing": {
            "prompt": "0.0000004",
            "completion": "0.0000019",
            "input_cache_read": "0.00000009",
            "discount": 0
          }
        }
      ],
      "other_parameters": {
        "source_model_id": "moonshotai/kimi-k2.5",
        "endpoint_tag": "modelrun/fp4",
        "context_length": 262144,
        "max_output_tokens": 262144,
        "supported_parameters": [
          "reasoning",
          "include_reasoning",
          "max_tokens",
          "temperature",
          "presence_penalty",
          "repetition_penalty",
          "frequency_penalty",
          "top_p",
          "top_k",
          "stop",
          "tools",
          "tool_choice",
          "structured_outputs",
          "response_format"
        ],
        "status": 0
      },
      "sources": [
        {
          "source": "openrouter:endpoints",
          "source_id": "moonshotai/kimi-k2.5#ModelRun | moonshotai/kimi-k2.5-0127",
          "observed_at": "2026-05-18T23:02:28.889Z"
        }
      ]
    }
  ],
  "other_parameters": {},
  "last_updated": "2026-05-18T23:02:28.889Z",
  "sources": []
}
