{
  "schema_version": 1,
  "id": "mara",
  "provider": "Mara",
  "currency": "USD",
  "offers": [
    {
      "model_id": "minimax-m2.5",
      "model": "MiniMax M2.5",
      "endpoint_path": "/chat/completions",
      "api_model_id": "mara",
      "mode": "chat",
      "prices": [
        {
          "conditions": {},
          "prices": {
            "input": {
              "amount": 0.3,
              "unit": "per_1m_tokens"
            },
            "output": {
              "amount": 1.2,
              "unit": "per_1m_tokens"
            }
          },
          "currency": "USD",
          "source": "openrouter-endpoint",
          "observed_at": "2026-05-19T22:11:55.841Z",
          "raw_pricing": {
            "prompt": "0.0000003",
            "completion": "0.0000012",
            "discount": 0
          }
        }
      ],
      "other_parameters": {
        "source_model_id": "minimax/minimax-m2.5:free",
        "endpoint_tag": "mara",
        "context_length": 196608,
        "max_output_tokens": 196608,
        "supported_parameters": [
          "reasoning",
          "include_reasoning",
          "max_tokens",
          "temperature",
          "stop",
          "top_k",
          "top_p"
        ],
        "status": 0
      },
      "sources": [
        {
          "source": "openrouter:endpoints",
          "source_id": "minimax/minimax-m2.5:free#Mara | minimax/minimax-m2.5-20260211",
          "observed_at": "2026-05-19T22:11:55.841Z"
        }
      ]
    },
    {
      "model_id": "gpt-oss-120b",
      "model": "gpt-oss-120b",
      "endpoint_path": "/chat/completions",
      "api_model_id": "mara",
      "mode": "chat",
      "prices": [
        {
          "conditions": {},
          "prices": {
            "input": {
              "amount": 0.15,
              "unit": "per_1m_tokens"
            },
            "output": {
              "amount": 0.75,
              "unit": "per_1m_tokens"
            }
          },
          "currency": "USD",
          "source": "openrouter-endpoint",
          "observed_at": "2026-05-21T19:00:07.736Z",
          "raw_pricing": {
            "prompt": "0.00000015",
            "completion": "0.00000075",
            "discount": 0
          }
        }
      ],
      "other_parameters": {
        "source_model_id": "openai/gpt-oss-120b:free",
        "endpoint_tag": "mara",
        "context_length": 131072,
        "max_output_tokens": 131072,
        "supported_parameters": [
          "reasoning",
          "include_reasoning",
          "max_tokens",
          "temperature",
          "stop",
          "top_k",
          "top_p",
          "tool_choice",
          "tools",
          "structured_outputs",
          "response_format"
        ],
        "status": 0
      },
      "sources": [
        {
          "source": "openrouter:endpoints",
          "source_id": "openai/gpt-oss-120b:free#Mara | openai/gpt-oss-120b",
          "observed_at": "2026-05-21T19:00:07.736Z"
        }
      ]
    }
  ],
  "other_parameters": {},
  "last_updated": "2026-05-21T21:36:01.873Z",
  "sources": []
}
