{
  "schema_version": 1,
  "id": "302ai",
  "provider": "302.AI",
  "currency": "USD",
  "icon": "/assets/provider-icons/302ai.svg",
  "base_url": "https://api.302.ai/v1",
  "domain": "doc.302.ai",
  "other_parameters": {
    "models_dev": {
      "model_count": 97,
      "doc": "https://doc.302.ai",
      "npm": "@ai-sdk/openai-compatible",
      "env": [
        "302AI_API_KEY"
      ],
      "remote_icon": "https://models.dev/logos/302ai.svg"
    }
  },
  "last_updated": "2026-05-21T22:27:33.665Z",
  "offers": [],
  "sources": [
    {
      "source": "models.dev",
      "source_id": "302ai",
      "url": "https://models.dev/api.json",
      "observed_at": "2026-05-21T22:27:33.665Z"
    }
  ]
}
