{
  "schema_version": 1,
  "id": "ai21",
  "provider": "Ai21",
  "currency": "USD",
  "offers": [
    {
      "model_id": "jamba-large-1.7",
      "model": "Jamba Large 1.7",
      "endpoint_path": "/chat/completions",
      "api_model_id": "ai21/fp8",
      "mode": "chat",
      "prices": [
        {
          "conditions": {},
          "prices": {
            "input": {
              "amount": 2,
              "unit": "per_1m_tokens"
            },
            "output": {
              "amount": 8,
              "unit": "per_1m_tokens"
            }
          },
          "currency": "USD",
          "source": "openrouter-endpoint",
          "observed_at": "2026-05-19T22:11:55.841Z",
          "raw_pricing": {
            "prompt": "0.000002",
            "completion": "0.000008",
            "discount": 0
          }
        }
      ],
      "other_parameters": {
        "source_model_id": "ai21/jamba-large-1.7",
        "endpoint_tag": "ai21/fp8",
        "context_length": 256000,
        "max_output_tokens": 4096,
        "supported_parameters": [
          "response_format",
          "max_tokens",
          "temperature",
          "top_p",
          "stop",
          "tools",
          "tool_choice"
        ],
        "status": 0
      },
      "sources": [
        {
          "source": "openrouter:endpoints",
          "source_id": "ai21/jamba-large-1.7#AI21 | ai21/jamba-large-1.7",
          "observed_at": "2026-05-19T22:11:55.841Z"
        }
      ]
    }
  ],
  "other_parameters": {},
  "last_updated": "2026-05-19T22:11:55.841Z",
  "sources": []
}
