{
  "schema_version": 1,
  "id": "dekallm",
  "provider": "DekaLLM",
  "currency": "USD",
  "offers": [
    {
      "model_id": "gemma-4-26b-a4b-it",
      "model": "Google: Gemma 4 26B A4B  (free)",
      "endpoint_path": "/images/generations",
      "api_model_id": "dekallm/bf16",
      "mode": "image",
      "prices": [
        {
          "conditions": {},
          "prices": {
            "input": {
              "amount": 0.06,
              "unit": "per_1m_tokens"
            },
            "output": {
              "amount": 0.33,
              "unit": "per_1m_tokens"
            }
          },
          "currency": "USD",
          "source": "openrouter-endpoint",
          "observed_at": "2026-05-18T23:02:28.889Z",
          "raw_pricing": {
            "prompt": "0.00000006",
            "completion": "0.00000033",
            "discount": 0
          }
        }
      ],
      "other_parameters": {
        "source_model_id": "google/gemma-4-26b-a4b-it:free",
        "endpoint_tag": "dekallm/bf16",
        "context_length": 262144,
        "max_output_tokens": null,
        "supported_parameters": [
          "reasoning",
          "include_reasoning",
          "frequency_penalty",
          "logit_bias",
          "max_tokens",
          "presence_penalty",
          "seed",
          "stop",
          "temperature",
          "top_p"
        ],
        "status": 0
      },
      "sources": [
        {
          "source": "openrouter:endpoints",
          "source_id": "google/gemma-4-26b-a4b-it:free#DekaLLM | google/gemma-4-26b-a4b-it-20260403",
          "observed_at": "2026-05-18T23:02:28.889Z"
        }
      ]
    },
    {
      "model_id": "gpt-oss-120b",
      "model": "OpenAI: gpt-oss-120b (free)",
      "endpoint_path": "/chat/completions",
      "api_model_id": "dekallm/bf16",
      "mode": "chat",
      "prices": [
        {
          "conditions": {},
          "prices": {
            "input": {
              "amount": 0.039,
              "unit": "per_1m_tokens"
            },
            "output": {
              "amount": 0.18,
              "unit": "per_1m_tokens"
            }
          },
          "currency": "USD",
          "source": "openrouter-endpoint",
          "observed_at": "2026-05-18T23:02:28.889Z",
          "raw_pricing": {
            "prompt": "0.000000039",
            "completion": "0.00000018",
            "discount": 0
          }
        }
      ],
      "other_parameters": {
        "source_model_id": "openai/gpt-oss-120b:free",
        "endpoint_tag": "dekallm/bf16",
        "context_length": 131072,
        "max_output_tokens": null,
        "supported_parameters": [
          "reasoning",
          "include_reasoning",
          "frequency_penalty",
          "logit_bias",
          "max_tokens",
          "presence_penalty",
          "seed",
          "stop",
          "temperature",
          "top_p",
          "tools",
          "tool_choice",
          "logprobs",
          "top_logprobs"
        ],
        "status": 0
      },
      "sources": [
        {
          "source": "openrouter:endpoints",
          "source_id": "openai/gpt-oss-120b:free#DekaLLM | openai/gpt-oss-120b",
          "observed_at": "2026-05-18T23:02:28.889Z"
        }
      ]
    },
    {
      "model_id": "mistral-nemo",
      "model": "Mistral: Mistral Nemo",
      "endpoint_path": "/chat/completions",
      "api_model_id": "dekallm/fp8",
      "mode": "chat",
      "prices": [
        {
          "conditions": {},
          "prices": {
            "input": {
              "amount": 0.02,
              "unit": "per_1m_tokens"
            },
            "output": {
              "amount": 0.03,
              "unit": "per_1m_tokens"
            }
          },
          "currency": "USD",
          "source": "openrouter-endpoint",
          "observed_at": "2026-05-18T23:02:28.889Z",
          "raw_pricing": {
            "prompt": "0.00000002",
            "completion": "0.00000003",
            "discount": 0
          }
        }
      ],
      "other_parameters": {
        "source_model_id": "mistralai/mistral-nemo",
        "endpoint_tag": "dekallm/fp8",
        "context_length": 131072,
        "max_output_tokens": null,
        "supported_parameters": [
          "frequency_penalty",
          "logit_bias",
          "max_tokens",
          "presence_penalty",
          "seed",
          "stop",
          "temperature",
          "top_p"
        ],
        "status": -2
      },
      "sources": [
        {
          "source": "openrouter:endpoints",
          "source_id": "mistralai/mistral-nemo#DekaLLM | mistralai/mistral-nemo",
          "observed_at": "2026-05-18T23:02:28.889Z"
        }
      ]
    },
    {
      "model_id": "nemotron-3-super-120b-a12b",
      "model": "NVIDIA: Nemotron 3 Super (free)",
      "endpoint_path": "/chat/completions",
      "api_model_id": "dekallm/fp8",
      "mode": "chat",
      "prices": [
        {
          "conditions": {},
          "prices": {
            "input": {
              "amount": 0.09,
              "unit": "per_1m_tokens"
            },
            "output": {
              "amount": 0.45,
              "unit": "per_1m_tokens"
            }
          },
          "currency": "USD",
          "source": "openrouter-endpoint",
          "observed_at": "2026-05-18T23:02:28.889Z",
          "raw_pricing": {
            "prompt": "0.00000009",
            "completion": "0.00000045",
            "discount": 0
          }
        }
      ],
      "other_parameters": {
        "source_model_id": "nvidia/nemotron-3-super-120b-a12b:free",
        "endpoint_tag": "dekallm/fp8",
        "context_length": 262144,
        "max_output_tokens": null,
        "supported_parameters": [
          "reasoning",
          "include_reasoning",
          "frequency_penalty",
          "logit_bias",
          "max_tokens",
          "presence_penalty",
          "seed",
          "stop",
          "temperature",
          "top_p",
          "tools",
          "tool_choice",
          "logprobs",
          "top_logprobs"
        ],
        "status": 0
      },
      "sources": [
        {
          "source": "openrouter:endpoints",
          "source_id": "nvidia/nemotron-3-super-120b-a12b:free#DekaLLM | nvidia/nemotron-3-super-120b-a12b-20230311",
          "observed_at": "2026-05-18T23:02:28.889Z"
        }
      ]
    },
    {
      "model_id": "qwen3.5-35b-a3b",
      "model": "Qwen: Qwen3.5-35B-A3B",
      "endpoint_path": "/images/generations",
      "api_model_id": "dekallm/fp8",
      "mode": "image",
      "prices": [
        {
          "conditions": {},
          "prices": {
            "input": {
              "amount": 0.15,
              "unit": "per_1m_tokens"
            },
            "output": {
              "amount": 1,
              "unit": "per_1m_tokens"
            }
          },
          "currency": "USD",
          "source": "openrouter-endpoint",
          "observed_at": "2026-05-18T23:02:28.889Z",
          "raw_pricing": {
            "prompt": "0.00000015",
            "completion": "0.000001",
            "discount": 0
          }
        }
      ],
      "other_parameters": {
        "source_model_id": "qwen/qwen3.5-35b-a3b",
        "endpoint_tag": "dekallm/fp8",
        "context_length": 262144,
        "max_output_tokens": null,
        "supported_parameters": [
          "reasoning",
          "include_reasoning",
          "frequency_penalty",
          "logit_bias",
          "max_tokens",
          "presence_penalty",
          "seed",
          "stop",
          "temperature",
          "top_p",
          "logprobs",
          "top_logprobs"
        ],
        "status": 0
      },
      "sources": [
        {
          "source": "openrouter:endpoints",
          "source_id": "qwen/qwen3.5-35b-a3b#DekaLLM | qwen/qwen3.5-35b-a3b-20260224",
          "observed_at": "2026-05-18T23:02:28.889Z"
        }
      ]
    }
  ],
  "other_parameters": {},
  "last_updated": "2026-05-18T23:02:28.889Z",
  "sources": []
}
