{
  "schema_version": 1,
  "id": "mancer",
  "provider": "Mancer",
  "currency": "USD",
  "offers": [
    {
      "model_id": "magnum-v4-72b",
      "model": "Magnum v4 72B",
      "endpoint_path": "/chat/completions",
      "api_model_id": "mancer/fp8",
      "mode": "chat",
      "prices": [
        {
          "conditions": {},
          "prices": {
            "input": {
              "amount": 3,
              "unit": "per_1m_tokens"
            },
            "output": {
              "amount": 5,
              "unit": "per_1m_tokens"
            }
          },
          "currency": "USD",
          "source": "openrouter-endpoint",
          "observed_at": "2026-05-19T22:11:55.841Z",
          "raw_pricing": {
            "prompt": "0.000003",
            "completion": "0.000005",
            "discount": 0
          }
        }
      ],
      "other_parameters": {
        "source_model_id": "anthracite-org/magnum-v4-72b",
        "endpoint_tag": "mancer/fp8",
        "context_length": 16384,
        "max_output_tokens": 2048,
        "supported_parameters": [
          "response_format",
          "max_tokens",
          "temperature",
          "top_p",
          "stop",
          "frequency_penalty",
          "presence_penalty",
          "repetition_penalty",
          "logit_bias",
          "top_k",
          "min_p",
          "seed",
          "top_a",
          "logprobs",
          "top_logprobs"
        ],
        "status": 0
      },
      "sources": [
        {
          "source": "openrouter:endpoints",
          "source_id": "anthracite-org/magnum-v4-72b#Mancer 2 | anthracite-org/magnum-v4-72b",
          "observed_at": "2026-05-19T22:11:55.841Z"
        }
      ]
    },
    {
      "model_id": "mythomax-l2-13b",
      "model": "MythoMax 13B",
      "endpoint_path": "/chat/completions",
      "api_model_id": "mancer/fp8",
      "mode": "chat",
      "prices": [
        {
          "conditions": {},
          "prices": {
            "input": {
              "amount": 0.5,
              "unit": "per_1m_tokens"
            },
            "output": {
              "amount": 0.75,
              "unit": "per_1m_tokens"
            }
          },
          "currency": "USD",
          "source": "openrouter-endpoint",
          "observed_at": "2026-05-19T22:11:55.841Z",
          "raw_pricing": {
            "prompt": "0.0000005",
            "completion": "0.00000075",
            "discount": 0
          }
        }
      ],
      "other_parameters": {
        "source_model_id": "gryphe/mythomax-l2-13b",
        "endpoint_tag": "mancer/fp8",
        "context_length": 8192,
        "max_output_tokens": 2048,
        "supported_parameters": [
          "max_tokens",
          "temperature",
          "top_p",
          "stop",
          "frequency_penalty",
          "presence_penalty",
          "repetition_penalty",
          "logit_bias",
          "top_k",
          "min_p",
          "seed",
          "top_a",
          "response_format",
          "logprobs",
          "top_logprobs"
        ],
        "status": 0
      },
      "sources": [
        {
          "source": "openrouter:endpoints",
          "source_id": "gryphe/mythomax-l2-13b#Mancer 2 | gryphe/mythomax-l2-13b",
          "observed_at": "2026-05-19T22:11:55.841Z"
        }
      ]
    },
    {
      "model_id": "remm-slerp-l2-13b",
      "model": "ReMM SLERP 13B",
      "endpoint_path": "/chat/completions",
      "api_model_id": "mancer/fp8",
      "mode": "chat",
      "prices": [
        {
          "conditions": {},
          "prices": {
            "input": {
              "amount": 0.5,
              "unit": "per_1m_tokens"
            },
            "output": {
              "amount": 0.75,
              "unit": "per_1m_tokens"
            }
          },
          "currency": "USD",
          "source": "openrouter-endpoint",
          "observed_at": "2026-05-19T22:11:55.841Z",
          "raw_pricing": {
            "prompt": "0.0000005",
            "completion": "0.00000075",
            "discount": 0
          }
        }
      ],
      "other_parameters": {
        "source_model_id": "undi95/remm-slerp-l2-13b",
        "endpoint_tag": "mancer/fp8",
        "context_length": 6144,
        "max_output_tokens": 2048,
        "supported_parameters": [
          "response_format",
          "max_tokens",
          "temperature",
          "top_p",
          "stop",
          "frequency_penalty",
          "presence_penalty",
          "repetition_penalty",
          "logit_bias",
          "top_k",
          "min_p",
          "seed",
          "top_a",
          "logprobs",
          "top_logprobs"
        ],
        "status": 0
      },
      "sources": [
        {
          "source": "openrouter:endpoints",
          "source_id": "undi95/remm-slerp-l2-13b#Mancer 2 | undi95/remm-slerp-l2-13b",
          "observed_at": "2026-05-19T22:11:55.841Z"
        }
      ]
    },
    {
      "model_id": "weaver",
      "model": "Weaver (alpha)",
      "endpoint_path": "/chat/completions",
      "api_model_id": "mancer/fp8",
      "mode": "chat",
      "prices": [
        {
          "conditions": {},
          "prices": {
            "input": {
              "amount": 0.75,
              "unit": "per_1m_tokens"
            },
            "output": {
              "amount": 1,
              "unit": "per_1m_tokens"
            }
          },
          "currency": "USD",
          "source": "openrouter-endpoint",
          "observed_at": "2026-05-19T22:11:55.841Z",
          "raw_pricing": {
            "prompt": "0.00000075",
            "completion": "0.000001",
            "discount": 0
          }
        }
      ],
      "other_parameters": {
        "source_model_id": "mancer/weaver",
        "endpoint_tag": "mancer/fp8",
        "context_length": 8000,
        "max_output_tokens": 2000,
        "supported_parameters": [
          "response_format",
          "max_tokens",
          "temperature",
          "top_p",
          "stop",
          "frequency_penalty",
          "presence_penalty",
          "repetition_penalty",
          "logit_bias",
          "top_k",
          "min_p",
          "seed",
          "top_a",
          "logprobs",
          "top_logprobs"
        ],
        "status": 0
      },
      "sources": [
        {
          "source": "openrouter:endpoints",
          "source_id": "mancer/weaver#Mancer 2 | mancer/weaver",
          "observed_at": "2026-05-19T22:11:55.841Z"
        }
      ]
    }
  ],
  "other_parameters": {},
  "last_updated": "2026-05-19T22:11:55.841Z",
  "sources": []
}
