{
  "schema_version": 1,
  "id": "xai",
  "provider": "xAI",
  "currency": "USD",
  "offers": [
    {
      "model_id": "grok-4.20",
      "model": "xAI: Grok 4.20",
      "endpoint_path": "/images/generations",
      "api_model_id": "xai",
      "mode": "image",
      "prices": [
        {
          "conditions": {},
          "prices": {
            "input": {
              "amount": 1.25,
              "unit": "per_1m_tokens"
            },
            "output": {
              "amount": 2.5,
              "unit": "per_1m_tokens"
            },
            "web_search": {
              "amount": 0.005,
              "unit": "per_request"
            }
          },
          "currency": "USD",
          "source": "openrouter-endpoint",
          "observed_at": "2026-05-18T23:02:28.889Z",
          "raw_pricing": {
            "prompt": "0.00000125",
            "completion": "0.0000025",
            "web_search": "0.005",
            "input_cache_read": "0.0000002",
            "discount": 0
          }
        }
      ],
      "other_parameters": {
        "source_model_id": "x-ai/grok-4.20",
        "endpoint_tag": "xai",
        "context_length": 2000000,
        "max_output_tokens": null,
        "supported_parameters": [
          "reasoning",
          "include_reasoning",
          "max_tokens",
          "temperature",
          "top_p",
          "seed",
          "logprobs",
          "top_logprobs",
          "response_format",
          "tools",
          "tool_choice",
          "structured_outputs"
        ],
        "status": 0
      },
      "sources": [
        {
          "source": "openrouter:endpoints",
          "source_id": "x-ai/grok-4.20#xAI | x-ai/grok-4.20-20260309",
          "observed_at": "2026-05-18T23:02:28.889Z"
        }
      ]
    },
    {
      "model_id": "grok-4.20-multi-agent",
      "model": "xAI: Grok 4.20 Multi-Agent",
      "endpoint_path": "/images/generations",
      "api_model_id": "xai",
      "mode": "image",
      "prices": [
        {
          "conditions": {},
          "prices": {
            "input": {
              "amount": 2,
              "unit": "per_1m_tokens"
            },
            "output": {
              "amount": 6,
              "unit": "per_1m_tokens"
            },
            "web_search": {
              "amount": 0.005,
              "unit": "per_request"
            }
          },
          "currency": "USD",
          "source": "openrouter-endpoint",
          "observed_at": "2026-05-18T23:02:28.889Z",
          "raw_pricing": {
            "prompt": "0.000002",
            "completion": "0.000006",
            "web_search": "0.005",
            "input_cache_read": "0.0000002",
            "discount": 0
          }
        }
      ],
      "other_parameters": {
        "source_model_id": "x-ai/grok-4.20-multi-agent",
        "endpoint_tag": "xai",
        "context_length": 2000000,
        "max_output_tokens": null,
        "supported_parameters": [
          "reasoning",
          "include_reasoning",
          "max_tokens",
          "temperature",
          "top_p",
          "seed",
          "logprobs",
          "top_logprobs",
          "response_format",
          "structured_outputs"
        ],
        "status": 0
      },
      "sources": [
        {
          "source": "openrouter:endpoints",
          "source_id": "x-ai/grok-4.20-multi-agent#xAI | x-ai/grok-4.20-multi-agent-20260309",
          "observed_at": "2026-05-18T23:02:28.889Z"
        }
      ]
    },
    {
      "model_id": "grok-4.3",
      "model": "xAI: Grok 4.3",
      "endpoint_path": "/images/generations",
      "api_model_id": "xai",
      "mode": "image",
      "prices": [
        {
          "conditions": {},
          "prices": {
            "input": {
              "amount": 1.25,
              "unit": "per_1m_tokens"
            },
            "output": {
              "amount": 2.5,
              "unit": "per_1m_tokens"
            },
            "web_search": {
              "amount": 0.005,
              "unit": "per_request"
            }
          },
          "currency": "USD",
          "source": "openrouter-endpoint",
          "observed_at": "2026-05-18T23:02:28.889Z",
          "raw_pricing": {
            "prompt": "0.00000125",
            "completion": "0.0000025",
            "web_search": "0.005",
            "input_cache_read": "0.0000002",
            "discount": 0
          }
        }
      ],
      "other_parameters": {
        "source_model_id": "x-ai/grok-4.3",
        "endpoint_tag": "xai",
        "context_length": 1000000,
        "max_output_tokens": null,
        "supported_parameters": [
          "reasoning",
          "include_reasoning",
          "structured_outputs",
          "response_format",
          "max_tokens",
          "temperature",
          "top_p",
          "seed",
          "logprobs",
          "top_logprobs",
          "stop",
          "frequency_penalty",
          "presence_penalty",
          "tools",
          "tool_choice"
        ],
        "status": 0
      },
      "sources": [
        {
          "source": "openrouter:endpoints",
          "source_id": "x-ai/grok-4.3#xAI | x-ai/grok-4.3-20260430",
          "observed_at": "2026-05-18T23:02:28.889Z"
        }
      ]
    }
  ],
  "other_parameters": {},
  "last_updated": "2026-05-18T23:02:28.889Z",
  "sources": []
}
